{
  "$schema": "https://json-schema.org/draft/2020-12/schema",
  "$id": "https://sagan-software.github.io/bevy-physics-bench/capacity.schema.json",
  "title": "Rendered growing workload capacity, version 1",
  "type": "object",
  "additionalProperties": false,
  "required": [
    "kind",
    "created_at",
    "machine",
    "browser",
    "os",
    "logical_cores",
    "viewport",
    "pixel_ratio",
    "metadata",
    "measurements"
  ],
  "properties": {
    "kind": {
      "const": "capacity-v1"
    },
    "created_at": {
      "type": "string",
      "pattern": "^\\d{4}-\\d{2}-\\d{2}T\\d{2}:\\d{2}:\\d{2}\\.\\d{3}Z$"
    },
    "machine": {
      "type": "string",
      "minLength": 1,
      "maxLength": 120
    },
    "browser": {
      "type": "string",
      "maxLength": 2000
    },
    "os": {
      "type": "string",
      "maxLength": 2000
    },
    "logical_cores": {
      "type": "integer",
      "minimum": 1,
      "maximum": 4096
    },
    "viewport": {
      "type": "array",
      "minItems": 2,
      "maxItems": 2,
      "items": {
        "type": "integer",
        "minimum": 1,
        "maximum": 16384
      }
    },
    "pixel_ratio": {
      "type": "number",
      "exclusiveMinimum": 0,
      "maximum": 2
    },
    "metadata": {
      "type": "object",
      "additionalProperties": false,
      "required": [
        "build",
        "versions",
        "target",
        "profile"
      ],
      "properties": {
        "build": {
          "type": "object",
          "additionalProperties": false,
          "required": [
            "compiler",
            "rustflags",
            "features"
          ],
          "properties": {
            "compiler": {
              "type": "string",
              "minLength": 1,
              "maxLength": 300
            },
            "rustflags": {
              "type": "string",
              "maxLength": 4000
            },
            "features": {
              "type": "array",
              "maxItems": 50,
              "uniqueItems": true,
              "items": {
                "type": "string",
                "minLength": 1,
                "maxLength": 100
              }
            }
          }
        },
        "versions": {
          "type": "object",
          "additionalProperties": false,
          "required": [
            "bevy",
            "avian",
            "bevy_rapier",
            "rapier",
            "oxijolt",
            "jolt_js",
            "nexus",
            "revision"
          ],
          "properties": {
            "bevy": {
              "type": "string",
              "minLength": 1,
              "maxLength": 100
            },
            "avian": {
              "type": "string",
              "minLength": 1,
              "maxLength": 100
            },
            "bevy_rapier": {
              "type": "string",
              "minLength": 1,
              "maxLength": 100
            },
            "rapier": {
              "type": "string",
              "minLength": 1,
              "maxLength": 100
            },
            "oxijolt": {
              "type": "string",
              "minLength": 1,
              "maxLength": 100
            },
            "jolt_js": {
              "type": "string",
              "minLength": 1,
              "maxLength": 100
            },
            "nexus": {
              "type": "string",
              "minLength": 1,
              "maxLength": 100
            },
            "revision": {
              "type": "string",
              "pattern": "^([a-f0-9]{40}(-dirty)?|unknown|working-tree)$"
            }
          }
        },
        "target": {
          "type": "string",
          "maxLength": 2000
        },
        "profile": {
          "enum": [
            "baseline",
            "native-tuned",
            "gpu"
          ]
        }
      }
    },
    "measurements": {
      "type": "array",
      "minItems": 1,
      "maxItems": 2,
      "items": {
        "type": "object",
        "additionalProperties": false,
        "required": [
          "engine",
          "settings",
          "plan",
          "score",
          "outcome",
          "detail",
          "levels",
          "scene_fingerprint",
          "gpu"
        ],
        "properties": {
          "engine": {
            "enum": [
              "avian",
              "rapier",
              "jolt",
              "nexus"
            ]
          },
          "settings": {
            "type": "object",
            "additionalProperties": false,
            "required": [
              "scenario",
              "dimension",
              "count",
              "seed",
              "hz",
              "gravity",
              "friction",
              "restitution",
              "solver_effort",
              "sleeping",
              "ccd"
            ],
            "properties": {
              "scenario": {
                "enum": [
                  "boxes",
                  "balls",
                  "pyramid",
                  "stacks",
                  "static-field",
                  "kinematics",
                  "dominoes",
                  "joint-chain",
                  "ragdolls",
                  "ccd",
                  "queries",
                  "characters",
                  "inverse-kinematics"
                ]
              },
              "dimension": {
                "enum": [
                  "2d",
                  "3d"
                ]
              },
              "count": {
                "type": "integer",
                "minimum": 1,
                "maximum": 32768
              },
              "seed": {
                "type": "integer",
                "minimum": 0,
                "maximum": 4294967295
              },
              "hz": {
                "enum": [
                  30,
                  60,
                  120,
                  240
                ]
              },
              "gravity": {
                "type": "number",
                "minimum": 0,
                "maximum": 50
              },
              "friction": {
                "type": "number",
                "minimum": 0,
                "maximum": 2
              },
              "restitution": {
                "type": "number",
                "minimum": 0,
                "maximum": 1
              },
              "solver_effort": {
                "type": "integer",
                "minimum": 1,
                "maximum": 32
              },
              "sleeping": {
                "enum": [
                  "disabled",
                  "enabled"
                ]
              },
              "ccd": {
                "enum": [
                  "discrete",
                  "continuous"
                ]
              }
            }
          },
          "plan": {
            "type": "object",
            "additionalProperties": false,
            "required": [
              "target_fps",
              "tolerance_percent",
              "increment",
              "maximum",
              "settle_ms",
              "window_ms"
            ],
            "properties": {
              "target_fps": {
                "type": "integer",
                "minimum": 1,
                "maximum": 240
              },
              "tolerance_percent": {
                "type": "integer",
                "minimum": 0,
                "maximum": 10
              },
              "increment": {
                "type": "integer",
                "minimum": 1,
                "maximum": 4096
              },
              "maximum": {
                "type": "integer",
                "minimum": 1,
                "maximum": 32768
              },
              "settle_ms": {
                "type": "integer",
                "minimum": 100,
                "maximum": 10000
              },
              "window_ms": {
                "type": "integer",
                "minimum": 100,
                "maximum": 10000
              }
            }
          },
          "score": {
            "type": "integer",
            "minimum": 0,
            "maximum": 32768
          },
          "outcome": {
            "enum": [
              "threshold",
              "limit",
              "error"
            ]
          },
          "detail": {
            "type": [
              "string",
              "null"
            ],
            "maxLength": 10000
          },
          "levels": {
            "type": "array",
            "maxItems": 32768,
            "items": {
              "type": "object",
              "additionalProperties": false,
              "required": [
                "count",
                "windows"
              ],
              "properties": {
                "count": {
                  "type": "integer",
                  "minimum": 1,
                  "maximum": 32768
                },
                "windows": {
                  "type": "array",
                  "minItems": 1,
                  "maxItems": 2,
                  "items": {
                    "type": "object",
                    "additionalProperties": false,
                    "required": [
                      "frames",
                      "elapsed_ms",
                      "fps"
                    ],
                    "properties": {
                      "frames": {
                        "type": "integer",
                        "minimum": 1,
                        "maximum": 1000000
                      },
                      "elapsed_ms": {
                        "type": "number",
                        "exclusiveMinimum": 0
                      },
                      "fps": {
                        "type": "number",
                        "exclusiveMinimum": 0
                      }
                    }
                  }
                }
              }
            }
          },
          "scene_fingerprint": {
            "type": "string",
            "pattern": "^[a-f0-9]{64}$"
          },
          "gpu": {
            "anyOf": [
              {
                "type": "null"
              },
              {
                "type": "object",
                "additionalProperties": false,
                "required": [
                  "name",
                  "backend",
                  "driver"
                ],
                "properties": {
                  "name": {
                    "type": "string",
                    "maxLength": 2000
                  },
                  "backend": {
                    "type": "string",
                    "maxLength": 2000
                  },
                  "driver": {
                    "type": [
                      "string",
                      "null"
                    ]
                  }
                }
              }
            ]
          }
        }
      }
    }
  }
}
