[
  {
    "browser": "Mozilla/5.0 (X11; Linux x86_64) AppleWebKit/537.36 (KHTML, like Gecko) T3Code(Alpha)/0.0.45 Chrome/152.0.7977.78 Electron/44.3.0 Safari/537.36",
    "created_at": "2026-10-10T07:45:21.471Z",
    "kind": "capacity-v1",
    "logical_cores": 32,
    "machine": "T3 Code visible Chromium (production)",
    "measurements": [
      {
        "detail": null,
        "engine": "rapier",
        "gpu": null,
        "levels": [
          {
            "count": 128,
            "windows": [
              {
                "elapsed_ms": 3003.399999976158,
                "fps": 238.06352800348802,
                "frames": 715
              }
            ]
          },
          {
            "count": 384,
            "windows": [
              {
                "elapsed_ms": 3000.300000011921,
                "fps": 237.97620237881648,
                "frames": 714
              }
            ]
          },
          {
            "count": 640,
            "windows": [
              {
                "elapsed_ms": 3000.800000011921,
                "fps": 223.27379365413836,
                "frames": 670
              }
            ]
          },
          {
            "count": 896,
            "windows": [
              {
                "elapsed_ms": 3001.699999988079,
                "fps": 200.21987540473293,
                "frames": 601
              }
            ]
          },
          {
            "count": 1152,
            "windows": [
              {
                "elapsed_ms": 3004.4000000059605,
                "fps": 181.73345759516602,
                "frames": 546
              }
            ]
          },
          {
            "count": 1408,
            "windows": [
              {
                "elapsed_ms": 3005.7000000178814,
                "fps": 151.04634527640786,
                "frames": 454
              }
            ]
          },
          {
            "count": 1664,
            "windows": [
              {
                "elapsed_ms": 3006.300000011921,
                "fps": 130.06020689833002,
                "frames": 391
              }
            ]
          },
          {
            "count": 1920,
            "windows": [
              {
                "elapsed_ms": 3003.699999988079,
                "fps": 120.85095049486988,
                "frames": 363
              }
            ]
          },
          {
            "count": 2176,
            "windows": [
              {
                "elapsed_ms": 3003.899999976158,
                "fps": 110.19008622212029,
                "frames": 331
              }
            ]
          },
          {
            "count": 2432,
            "windows": [
              {
                "elapsed_ms": 3001,
                "fps": 90.3032322559147,
                "frames": 271
              }
            ]
          },
          {
            "count": 2688,
            "windows": [
              {
                "elapsed_ms": 3000.2000000178814,
                "fps": 88.99406706166545,
                "frames": 267
              }
            ]
          },
          {
            "count": 2944,
            "windows": [
              {
                "elapsed_ms": 3000,
                "fps": 88,
                "frames": 264
              }
            ]
          },
          {
            "count": 3200,
            "windows": [
              {
                "elapsed_ms": 3009.899999976158,
                "fps": 83.3914748004878,
                "frames": 251
              }
            ]
          },
          {
            "count": 3456,
            "windows": [
              {
                "elapsed_ms": 3004.899999976158,
                "fps": 78.53838730136528,
                "frames": 236
              }
            ]
          },
          {
            "count": 3712,
            "windows": [
              {
                "elapsed_ms": 3009,
                "fps": 69.79062811565304,
                "frames": 210
              }
            ]
          },
          {
            "count": 3968,
            "windows": [
              {
                "elapsed_ms": 3013,
                "fps": 63.72386325921009,
                "frames": 192
              }
            ]
          },
          {
            "count": 4224,
            "windows": [
              {
                "elapsed_ms": 3012.5999999940395,
                "fps": 58.753236407206465,
                "frames": 177
              }
            ]
          },
          {
            "count": 4480,
            "windows": [
              {
                "elapsed_ms": 3016,
                "fps": 58.687002652519894,
                "frames": 177
              }
            ]
          },
          {
            "count": 4736,
            "windows": [
              {
                "elapsed_ms": 3002.2999999821186,
                "fps": 54.624787663117196,
                "frames": 164
              },
              {
                "elapsed_ms": 3011.0999999940395,
                "fps": 56.12566836051096,
                "frames": 169
              }
            ]
          }
        ],
        "outcome": "threshold",
        "plan": {
          "increment": 256,
          "maximum": 8192,
          "settle_ms": 1000,
          "target_fps": 60,
          "tolerance_percent": 3,
          "window_ms": 3000
        },
        "scene_fingerprint": "62884ea66d4d4e488332ef28969e46da95c068b3ad48aaeac58a57c77ec337bc",
        "score": 4480,
        "settings": {
          "ccd": "discrete",
          "count": 128,
          "dimension": "2d",
          "friction": 0.5,
          "gravity": 9.81,
          "hz": 60,
          "restitution": 0,
          "scenario": "balls",
          "seed": 42,
          "sleeping": "disabled",
          "solver_effort": 4
        }
      }
    ],
    "metadata": {
      "build": {
        "compiler": "rustc 1.98.1 (48a229cea 2026-09-01)",
        "features": [
          "avian2d",
          "avian3d",
          "bevy_rapier2d",
          "bevy_rapier3d"
        ],
        "rustflags": "-C target-feature=+simd128"
      },
      "profile": "baseline",
      "target": "wasm32-unknown-unknown",
      "versions": {
        "avian": "0.7.0",
        "bevy": "0.19.1",
        "bevy_rapier": "0.36.0",
        "jolt_js": "1.1.0",
        "nexus": "0.6.0",
        "oxijolt": "1.0.1+jolt-5.6.0",
        "rapier": "0.35.0-glamx0.2",
        "revision": "33a7573a3dab4b100939e77508737373401c8ab5"
      }
    },
    "os": "Linux x86_64",
    "pixel_ratio": 1.4500000476837158,
    "viewport": [
      947,
      390
    ]
  },
  {
    "browser": "Mozilla/5.0 (X11; Linux x86_64) AppleWebKit/537.36 (KHTML, like Gecko) T3Code(Alpha)/0.0.45 Chrome/152.0.7977.78 Electron/44.3.0 Safari/537.36",
    "created_at": "2026-10-10T07:43:10.999Z",
    "kind": "capacity-v1",
    "logical_cores": 32,
    "machine": "T3 Code visible Chromium (production)",
    "measurements": [
      {
        "detail": null,
        "engine": "jolt",
        "gpu": null,
        "levels": [
          {
            "count": 128,
            "windows": [
              {
                "elapsed_ms": 3002.2000000178814,
                "fps": 167.2107121434315,
                "frames": 502
              }
            ]
          },
          {
            "count": 384,
            "windows": [
              {
                "elapsed_ms": 3012.5,
                "fps": 105.22821576763485,
                "frames": 317
              }
            ]
          },
          {
            "count": 640,
            "windows": [
              {
                "elapsed_ms": 3003.2999999821186,
                "fps": 71.58791995514271,
                "frames": 215
              }
            ]
          },
          {
            "count": 896,
            "windows": [
              {
                "elapsed_ms": 3004.100000023842,
                "fps": 61.249625511314434,
                "frames": 184
              }
            ]
          },
          {
            "count": 1152,
            "windows": [
              {
                "elapsed_ms": 3003.699999988079,
                "fps": 48.27379565222075,
                "frames": 145
              },
              {
                "elapsed_ms": 3006.0999999940395,
                "fps": 43.91071487983159,
                "frames": 132
              }
            ]
          }
        ],
        "outcome": "threshold",
        "plan": {
          "increment": 256,
          "maximum": 4096,
          "settle_ms": 1000,
          "target_fps": 60,
          "tolerance_percent": 3,
          "window_ms": 3000
        },
        "scene_fingerprint": "bd0f2bd0b5e5ce6bbe0b1ad2a23542ebf9f50d69673bc3259a43b7cedf80392a",
        "score": 896,
        "settings": {
          "ccd": "discrete",
          "count": 128,
          "dimension": "3d",
          "friction": 0.5,
          "gravity": 9.81,
          "hz": 60,
          "restitution": 0,
          "scenario": "balls",
          "seed": 42,
          "sleeping": "disabled",
          "solver_effort": 4
        }
      }
    ],
    "metadata": {
      "build": {
        "compiler": "rustc 1.98.1 (48a229cea 2026-09-01)",
        "features": [
          "avian2d",
          "avian3d",
          "bevy_rapier2d",
          "bevy_rapier3d"
        ],
        "rustflags": "-C target-feature=+simd128"
      },
      "profile": "baseline",
      "target": "wasm32-unknown-unknown",
      "versions": {
        "avian": "0.7.0",
        "bevy": "0.19.1",
        "bevy_rapier": "0.36.0",
        "jolt_js": "1.1.0",
        "nexus": "0.6.0",
        "oxijolt": "1.0.1+jolt-5.6.0",
        "rapier": "0.35.0-glamx0.2",
        "revision": "33a7573a3dab4b100939e77508737373401c8ab5"
      }
    },
    "os": "Linux x86_64",
    "pixel_ratio": 1.4500000476837158,
    "viewport": [
      947,
      390
    ]
  },
  {